{
  "test_case_id": "TC-020",
  "variant_id": "v42",
  "language": "Python",
  "package": "scipy",
  "package_version": "unknown",
  "overall": {
    "orr_experimental": 37.8,
    "orr_control": 15.7,
    "n_experimental": 111,
    "n_control": 89,
    "responders_experimental": 42,
    "responders_control": 14,
    "ci_lower_experimental": 29.4,
    "ci_upper_experimental": 47.1,
    "ci_lower_control": 9.6,
    "ci_upper_control": 24.7,
    "orr_difference": 22.1
  },
  "subgroups": [
    {
      "subgroup": "SEX",
      "level": "Male",
      "orr_experimental": 40.5,
      "orr_control": 21.2,
      "n_experimental": 74,
      "n_control": 52,
      "responders_experimental": 30,
      "responders_control": 11,
      "ci_lower_experimental": 30.1,
      "ci_upper_experimental": 51.9,
      "ci_lower_control": 12.2,
      "ci_upper_control": 34.0,
      "orr_difference": 19.4,
      "diff_ci_lower": 3.6,
      "diff_ci_upper": 35.1
    },
    {
      "subgroup": "SEX",
      "level": "Female",
      "orr_experimental": 32.4,
      "orr_control": 8.1,
      "n_experimental": 37,
      "n_control": 37,
      "responders_experimental": 12,
      "responders_control": 3,
      "ci_lower_experimental": 19.6,
      "ci_upper_experimental": 48.5,
      "ci_lower_control": 2.8,
      "ci_upper_control": 21.3,
      "orr_difference": 24.3,
      "diff_ci_lower": 6.9,
      "diff_ci_upper": 41.8
    },
    {
      "subgroup": "AGEGR1",
      "level": "<65",
      "orr_experimental": 36.8,
      "orr_control": 11.8,
      "n_experimental": 76,
      "n_control": 68,
      "responders_experimental": 28,
      "responders_control": 8,
      "ci_lower_experimental": 26.9,
      "ci_upper_experimental": 48.1,
      "ci_lower_control": 6.1,
      "ci_upper_control": 21.5,
      "orr_difference": 25.1,
      "diff_ci_lower": 11.8,
      "diff_ci_upper": 38.4
    },
    {
      "subgroup": "AGEGR1",
      "level": ">=65",
      "orr_experimental": 40.0,
      "orr_control": 28.6,
      "n_experimental": 35,
      "n_control": 21,
      "responders_experimental": 14,
      "responders_control": 6,
      "ci_lower_experimental": 25.6,
      "ci_upper_experimental": 56.4,
      "ci_lower_control": 13.8,
      "ci_upper_control": 50.0,
      "orr_difference": 11.4,
      "diff_ci_lower": -13.8,
      "diff_ci_upper": 36.7
    }
  ],
  "interaction_pvalues": [
    {
      "subgroup": "SEX",
      "cmh_p_value": 0.0009,
      "cmh_common_or": 3.1465
    },
    {
      "subgroup": "AGEGR1",
      "cmh_p_value": 0.0008,
      "cmh_common_or": 3.1356
    }
  ],
  "seed": 42
}